{"approval":{"authorization_reference":"PE4-ACTION-E-HANDOFF-ACCEPTANCE-20261005","decisions_record":"DECISIONS.md#action-e-handoff-acceptance-2026-10-05","master_plan_record":"docs/HIOC_MASTER_PLAN.md#action-e-handoff-acceptance-2026-10-05","state":"ACCEPTED"},"capture":{"capture_id":"ed2af1a61929197bd045c08ee654bba4","manifest_sha256":"622c81614ec10a5cd6408b83b506e8d58f21de542b389bcc2dcd3fae4b9f108c","report_sha256":"1b3ed36af9da63742d5977bb185084ad152634b8ff3a0a6e97e54d3dfeccd02e","source_commit":"350dda0d1bc138f5adbbf2c15ac9ecd128eefd9f","tree_sha256":"4a929181d69f7391b3e39a0fd27fb17aa9c8883f42d9707af559c9a986d514a9"},"continuity":{"attestation_sha256":"0ba4f111a1a8cc21336c7c4676f0f19fa37d166158155aa9fe88153b7dff7c49","evidence_class":"GOVERNANCE_ATTESTED_E_TO_CAPTURE","historical_recursive_continuity_machine_proven":false,"historical_recursive_snapshot_persisted":false,"limitation":"NO_PERSISTED_E_TIME_RECURSIVE_BASELINE"},"durable_bundle":{"directory":"/home/jazofv1/hioc/runtime/pe4/handoffs/action-e-1c1698f009457baa1c3b548db31916559fcc2fc8","manifest_sha256":"1f5c5b477a01e3ef82017d8d57a70f864cb0ddb6ba28371989a3124b1cecf804"},"e_semantics":{"ACTION":"DEPENDENCY_VALIDATION","CAPABILITY_VALIDATION":"PASS","ENVIRONMENT_IDENTITY":"cpython311-websockets16.1.1-lock-v1","INSTALLED_VERSION":"16.1.1","action":"PE-4.0B.2a-E","error_code":"NONE","failure_stage":"COMPLETE","result":"PASS","rollback_recommended":false,"schema_version":"1.0"},"historical":{"construction_path":"/home/jazofv1/hioc/runtime/pe4/environments/.construct-cpython311-websockets16.1.1-lock-v1-mwJVPNqh","d_evidence_directory":"/tmp/hioc-pe4-runtime-construct-LW9Dvay6","d_evidence_sha256":"a31f1e841f437dece13d327f14a99a93d5f96a8e258b9786cc6e49358821350d","d_producer":"6c431494c88688fef9a2fec7c7e81de0f503bdc2","d_source_sha256":"e979cc6049f8912c23e880f121fd2988d0354623c4f2a7d27eafb310e4b0c213","e_evidence_directory":"/tmp/hioc-pe4-dependency-validate-9ys_lrah","e_evidence_sha256":"8d5ff1f602861d88ea8d363665a67091da2739686d10ab4aa9ac27f22389d834","e_execution_consumer":"1c1698f009457baa1c3b548db31916559fcc2fc8","environment_identity":"cpython311-websockets16.1.1-lock-v1","interpreter":{"dev":45826,"ino":823209},"native_member":"websockets/speedups.cpython-311-aarch64-linux-gnu.so","native_sha256":"b786db296f7d0677ddeceb7efbe963bc316a094f36e12388caa1333763ca4c1b","root":{"dev":45826,"gid":1000,"ino":823199,"mode":"0750","uid":1000}},"lifecycle_state":"E_PASS_CLOSED","record_type":"ACCEPTED_ACTION_E_HANDOFF","revalidated_observables":[{"comparison_basis":"RETAINED_VALUE","observable":"CONSTRUCTION_PATH","result":"PASS","source_class":"RETAINED_MACHINE_OBSERVATION","source_reference":"docs/PE4_ISOLATED_RUNTIME_LIFECYCLE.md@95a26c687f3cb3b1cc1cf6ee121e0ed01ad0c2e9; governed historical evidence"},{"comparison_basis":"RETAINED_VALUE","observable":"ROOT_IDENTITY","result":"PASS","source_class":"RETAINED_MACHINE_OBSERVATION","source_reference":"docs/PE4_ISOLATED_RUNTIME_LIFECYCLE.md@95a26c687f3cb3b1cc1cf6ee121e0ed01ad0c2e9; governed historical evidence"},{"comparison_basis":"RETAINED_VALUE","observable":"INTERPRETER_IDENTITY","result":"PASS","source_class":"RETAINED_MACHINE_OBSERVATION","source_reference":"docs/PE4_ISOLATED_RUNTIME_LIFECYCLE.md@95a26c687f3cb3b1cc1cf6ee121e0ed01ad0c2e9; governed historical evidence"},{"comparison_basis":"COMMITTED_POLICY","observable":"D_ELIGIBILITY","result":"PASS","source_class":"COMMITTED_POLICY","source_reference":"docs/PE4_ISOLATED_RUNTIME_LIFECYCLE.md@95a26c687f3cb3b1cc1cf6ee121e0ed01ad0c2e9; governed historical evidence"},{"comparison_basis":"RETAINED_VALUE","observable":"D_EVIDENCE","result":"PASS","source_class":"RETAINED_MACHINE_OBSERVATION","source_reference":"docs/PE4_ISOLATED_RUNTIME_LIFECYCLE.md@95a26c687f3cb3b1cc1cf6ee121e0ed01ad0c2e9; governed historical evidence"},{"comparison_basis":"RETAINED_VALUE","observable":"E_EVIDENCE","result":"PASS","source_class":"RETAINED_MACHINE_OBSERVATION","source_reference":"docs/PE4_ISOLATED_RUNTIME_LIFECYCLE.md@95a26c687f3cb3b1cc1cf6ee121e0ed01ad0c2e9; governed historical evidence"},{"comparison_basis":"RETAINED_VALUE","observable":"NATIVE_MEMBER","result":"PASS","source_class":"RETAINED_MACHINE_OBSERVATION","source_reference":"docs/PE4_ISOLATED_RUNTIME_LIFECYCLE.md@95a26c687f3cb3b1cc1cf6ee121e0ed01ad0c2e9; governed historical evidence"},{"comparison_basis":"COMMITTED_POLICY","observable":"GOVERNED_MEMBERS","result":"PASS","source_class":"COMMITTED_POLICY","source_reference":"docs/PE4_ISOLATED_RUNTIME_LIFECYCLE.md@95a26c687f3cb3b1cc1cf6ee121e0ed01ad0c2e9; governed historical evidence"},{"comparison_basis":"COMMITTED_POLICY","observable":"GIT_LINEAGE","result":"PASS","source_class":"COMMITTED_POLICY","source_reference":"docs/PE4_ISOLATED_RUNTIME_LIFECYCLE.md@95a26c687f3cb3b1cc1cf6ee121e0ed01ad0c2e9; governed historical evidence"},{"comparison_basis":"COMMITTED_POLICY","observable":"PUBLICATION_ABSENT","result":"PASS","source_class":"COMMITTED_POLICY","source_reference":"docs/PE4_ISOLATED_RUNTIME_LIFECYCLE.md@95a26c687f3cb3b1cc1cf6ee121e0ed01ad0c2e9; governed historical evidence"}],"schema_version":"1.0","supervisor_attestation_class":"GOVERNANCE_DERIVED_ATTESTATION"}
